{
  "$schema": "https://json-schema.org/draft/2020-12/schema",
  "$id": "https://strategyforge.app/schemas/strategy-1.0.json",
  "title": "StrategyForge strategy file 1.0",
  "description": "Restricted declarative strategy format. No executable content, expressions or unknown fields. Semantic rules are enforced in addition to this schema.",
  "type": "object",
  "additionalProperties": false,
  "required": ["schemaVersion", "metadata", "universe", "dataRequirements", "entryRules", "exitRules", "positionSizing", "orderInstructions", "riskLimits", "inactivityConditions"],
  "properties": {
    "schemaVersion": { "const": "1.0" },
    "strategyId": { "type": "string", "pattern": "^[0-9a-fA-F]{8}-[0-9a-fA-F]{4}-[0-9a-fA-F]{4}-[0-9a-fA-F]{4}-[0-9a-fA-F]{12}$" },
    "version": { "type": "integer", "minimum": 1, "maximum": 1000000 },
    "metadata": {
      "type": "object",
      "additionalProperties": false,
      "required": ["name", "assetClass", "timeframe"],
      "properties": {
        "name": { "type": "string", "minLength": 1, "maxLength": 80 },
        "description": { "type": "string", "maxLength": 1000 },
        "assetClass": { "enum": ["US_EQUITY", "CRYPTO"] },
        "timeframe": { "enum": ["1m", "5m", "15m", "1h", "4h", "1d"] },
        "createdBy": { "enum": ["OWNER", "AI_COMPILED", "IMPORTED"] },
        "direction": { "enum": ["LONG_ONLY", "SHORT_ONLY"] },
        "tags": { "type": "array", "maxItems": 10, "items": { "type": "string", "maxLength": 20, "pattern": "^[A-Za-z0-9 _-]+$" } }
      }
    },
    "universe": {
      "type": "object",
      "additionalProperties": false,
      "required": ["symbols"],
      "properties": {
        "symbols": {
          "type": "array",
          "minItems": 1,
          "maxItems": 500,
          "uniqueItems": true,
          "items": { "type": "string", "pattern": "^[A-Z][A-Z0-9.]{0,9}(-USD)?$" }
        }
      }
    },
    "dataRequirements": {
      "type": "object",
      "additionalProperties": false,
      "required": ["minimumHistoryBars", "maximumQuoteAgeSeconds", "indicators"],
      "properties": {
        "minimumHistoryBars": { "type": "integer", "minimum": 1, "maximum": 5000 },
        "maximumQuoteAgeSeconds": { "type": "integer", "minimum": 1, "maximum": 3600 },
        "indicators": { "type": "array", "maxItems": 20, "items": { "$ref": "#/$defs/indicator" } }
      }
    },
    "entryRules": { "$ref": "#/$defs/ruleGroup" },
    "exitRules": {
      "type": "object",
      "additionalProperties": false,
      "required": ["stopLossPercent", "takeProfitPercent", "maximumHoldingBars"],
      "properties": {
        "stopLossPercent": { "type": "number", "exclusiveMinimum": 0, "maximum": 50 },
        "takeProfitPercent": { "type": "number", "exclusiveMinimum": 0, "maximum": 500 },
        "trailingStopPercent": { "type": "number", "exclusiveMinimum": 0, "maximum": 50 },
        "maximumHoldingBars": { "type": "integer", "minimum": 1, "maximum": 10000 },
        "conditions": { "$ref": "#/$defs/ruleGroup" }
      }
    },
    "positionSizing": {
      "type": "object",
      "additionalProperties": false,
      "required": ["method", "value"],
      "properties": {
        "method": { "enum": ["FIXED_CASH", "PERCENT_OF_EQUITY", "FIXED_QUANTITY"] },
        "value": { "type": "number", "exclusiveMinimum": 0, "maximum": 10000000 }
      }
    },
    "orderInstructions": {
      "type": "object",
      "additionalProperties": false,
      "required": ["orderType", "timeInForce"],
      "properties": {
        "orderType": { "enum": ["MARKET", "LIMIT"] },
        "timeInForce": { "enum": ["DAY", "GTC"] },
        "limitOffsetPercent": { "type": "number", "minimum": 0, "maximum": 10 }
      }
    },
    "riskLimits": {
      "type": "object",
      "additionalProperties": false,
      "required": ["maximumOpenPositions", "maximumDailyTrades", "maximumDailyLossPercent", "allowShort"],
      "properties": {
        "maximumOpenPositions": { "type": "integer", "minimum": 1, "maximum": 500 },
        "maximumDailyTrades": { "type": "integer", "minimum": 1, "maximum": 1000 },
        "maximumDailyLossPercent": { "type": "number", "exclusiveMinimum": 0, "maximum": 100 },
        "maximumDrawdownPercent": { "type": "number", "exclusiveMinimum": 0, "maximum": 100 },
        "maximumPositionPercent": { "type": "number", "exclusiveMinimum": 0, "maximum": 100 },
        "maximumConsecutiveLosses": { "type": "integer", "minimum": 1, "maximum": 100 },
        "allowShort": { "type": "boolean" }
      }
    },
    "schedule": {
      "type": "object",
      "additionalProperties": false,
      "properties": {
        "evaluate": { "enum": ["ON_BAR_CLOSE"] },
        "sessions": { "enum": ["REGULAR"] }
      }
    },
    "inactivityConditions": {
      "type": "array",
      "uniqueItems": true,
      "maxItems": 10,
      "items": { "enum": ["STALE_MARKET_DATA", "RISK_ENGINE_UNAVAILABLE", "RECONCILIATION_FAILURE", "MISSING_HISTORY", "PROVIDER_UNAVAILABLE"] }
    }
  },
  "$defs": {
    "indicator": {
      "type": "object",
      "additionalProperties": false,
      "required": ["id", "type"],
      "properties": {
        "id": { "type": "string", "pattern": "^[A-Z][A-Z0-9_]{0,31}$" },
        "type": { "enum": ["SMA", "EMA", "RSI", "MACD", "ATR", "BOLLINGER_BANDS"] },
        "period": { "type": "integer", "minimum": 2, "maximum": 500 },
        "fastPeriod": { "type": "integer", "minimum": 2, "maximum": 500 },
        "slowPeriod": { "type": "integer", "minimum": 2, "maximum": 500 },
        "signalPeriod": { "type": "integer", "minimum": 2, "maximum": 500 },
        "standardDeviations": { "type": "number", "minimum": 0.5, "maximum": 5 },
        "source": { "enum": ["CLOSE", "OPEN", "HIGH", "LOW"] }
      }
    },
    "operand": {
      "oneOf": [
        { "type": "string", "pattern": "^([A-Z][A-Z0-9_]{0,31})(\\.(value|signal|histogram|upper|middle|lower))?$" },
        { "type": "number", "minimum": -1000000000, "maximum": 1000000000 }
      ]
    },
    "condition": {
      "type": "object",
      "additionalProperties": false,
      "required": ["left", "comparison", "right"],
      "properties": {
        "left": { "$ref": "#/$defs/operand" },
        "comparison": { "enum": ["GT", "GTE", "LT", "LTE", "EQ", "CROSSES_ABOVE", "CROSSES_BELOW"] },
        "right": { "$ref": "#/$defs/operand" },
        "offsetBars": { "type": "integer", "minimum": -1000, "maximum": 100 }
      }
    },
    "ruleGroup": {
      "type": "object",
      "additionalProperties": false,
      "required": ["operator", "conditions"],
      "properties": {
        "operator": { "enum": ["ALL", "ANY"] },
        "conditions": {
          "type": "array",
          "minItems": 1,
          "maxItems": 20,
          "items": { "anyOf": [{ "$ref": "#/$defs/condition" }, { "$ref": "#/$defs/ruleGroup" }] }
        }
      }
    }
  }
}
