{
  "schemaVersion": "1.0",
  "strategyId": "00000000-0000-0000-0000-000000000001",
  "version": 1,
  "metadata": {
    "name": "Momentum Example",
    "description": "Example only",
    "assetClass": "US_EQUITY",
    "timeframe": "1h",
    "createdBy": "AI_COMPILED"
  },
  "universe": {
    "symbols": [
      "AAPL",
      "MSFT"
    ]
  },
  "dataRequirements": {
    "minimumHistoryBars": 200,
    "maximumQuoteAgeSeconds": 30,
    "indicators": [
      {
        "id": "SMA_20",
        "type": "SMA",
        "period": 20
      },
      {
        "id": "SMA_50",
        "type": "SMA",
        "period": 50
      }
    ]
  },
  "entryRules": {
    "operator": "ALL",
    "conditions": [
      {
        "left": "CLOSE",
        "comparison": "GT",
        "right": 200
      },
      {
        "left": "CLOSE",
        "comparison": "LT",
        "right": 150
      }
    ]
  },
  "exitRules": {
    "stopLossPercent": 3.0,
    "takeProfitPercent": 6.0,
    "maximumHoldingBars": 120
  },
  "positionSizing": {
    "method": "PERCENT_OF_EQUITY",
    "value": 2.0
  },
  "orderInstructions": {
    "orderType": "MARKET",
    "timeInForce": "DAY"
  },
  "riskLimits": {
    "maximumOpenPositions": 5,
    "maximumDailyTrades": 10,
    "maximumDailyLossPercent": 2.0,
    "allowShort": false
  },
  "inactivityConditions": [
    "STALE_MARKET_DATA",
    "RISK_ENGINE_UNAVAILABLE",
    "RECONCILIATION_FAILURE"
  ]
}